### ISSUE TITLE
Set method : Throws error when we use timeduration other than zero

### ISSUE THREAD

**Issue by sanjeevkkn** [redis/go-redis#1449]
redisclient.set method throw error "ERR wrong number of arguments for 'set' command" if we send time.duration as parameter but works fine if we put 0 for expire parameter

**Comment by x1nchen** [comment]
Maybe you should paste code snippet that can reproduce this issue

**Comment by sanjeevkkn** [comment]
### Code Snippet
    hours, _ := time.ParseDuration("10h")
    errAccess := client.Set('KEY" ," VALUE", hours).Err()
    if errAccess != nil {
        return errAccess
    }

**Comment by x1nchen** [comment]
Hi, which version are you using?

I tested v8.0.0-beta.8, it works

```golang
package main

import (
	"context"
	"github.com/go-redis/redis/v8"
	"time"
)

func main() {
	ctx := context.Background()
	rdb := redis.NewClient(&redis.Options{
		Addr:     "127.0.0.1:6379",
		Password: "",
		DB:       0,
		PoolSize: 30,
	})

	hours, err  := time.ParseDuration("10h")

	if err != nil {
		panic(err)
	}

	errAccess := rdb.Set(ctx,"KEY" ," VALUE", hours).Err()
	if errAccess != nil {
		panic(err)
	}
}

```

**Comment by sanjeevkkn** [comment]
I am using the same version.
###  Code
```
 package main

import (
	"context"
	"time"

	"github.com/go-redis/redis/v8"
)

func main() {
	ctx := context.Background()
	rdb := redis.NewClient(&redis.Options{
		Addr:     "127.0.0.1:6379",
		Password: "",
		DB:       0,
		PoolSize: 30,
	})

	hours, err := time.ParseDuration("10h")

	if err != nil {
		panic(err)
	}

	errAccess := rdb.Set(ctx, "KEY", " VALUE", hours).Err()
	if errAccess != nil {
		panic(errAccess)
	}
}
```

Error Screenshot
![ErrorScreenshot](https://user-images.githubusercontent.com/44251557/91381673-96496000-e845-11ea-90bd-d0d796da7d87.PNG)

**Comment by sanjeevkkn** [comment]
> ```go
> 		panic(err)
> ```

**Comment by x1nchen** [comment]
emmm..

The `Set` command has been sent to redis server in your case because this error `ERR wrong number of arguments for 'set' command` returned from redis server.

It seems to be  absence of  parameter of Set command. just like this 


![image](https://user-images.githubusercontent.com/49012056/91382862-45ddfc80-e85d-11ea-9abf-9028bda18536.png)

Emmm... Maybe you can use tcpdump to debug the traffic ?

```
sudo tcpdump -i lo0 port 6379
```

**Comment by x1nchen** [comment]
[redis_client_test.zip](https://github.com/go-redis/redis/files/5134000/redis_client_test.zip)

I made a minimal prototype for this issue, you can download it and unzip to a directory NOT IN GOPATH.

And go run main.go

**Comment by sanjeevkkn** [comment]
yeah I have ran that file but changed  errAccess instead of  err in line no 26 thrown same error

### ErrorScreenShot
![redis_set_error](https://user-images.githubusercontent.com/44251557/91384183-8e8cba00-e84b-11ea-9037-e1870bde257f.PNG)

**Comment by x1nchen** [comment]
emmm...  so strange

Could you use tcpdump?

```
sudo tcpdump -i lo0 port 6379
```

correct case

```
12:30:15.015061 IP localhost.53147 > localhost.6379: Flags [P.], seq 1:54, ack 1, win 6379, options [nop,nop,TS val 1077678683 ecr 1077678683], length 53: RESP "set" "KEY" " VALUE" "ex" "36000"
12:30:15.015080 IP localhost.6379 > localhost.53147: Flags [.], ack 54, win 6378, options [nop,nop,TS val 1077678683 ecr 1077678683], length 0
12:30:15.017107 IP localhost.6379 > localhost.53147: Flags [P.], seq 1:6, ack 54, win 6378, options [nop,nop,TS val 1077678685 ecr 1077678683], length 5: RESP "OK"
12:30:15.017127 IP localhost.53147 > localhost.6379: Flags [.], ack 6, win 6379, options [nop,nop,TS val 1077678685 ecr 1077678685], length 0
```

wrong case

```
12:31:42.116711 IP localhost.58768 > localhost.6379: Flags [P.], seq 1:14, ack 1, win 6089, options [nop,nop,TS val 1077765198 ecr 1075634780], length 13: RESP "set"
12:31:42.116733 IP localhost.6379 > localhost.58768: Flags [.], ack 14, win 6377, options [nop,nop,TS val 1077765198 ecr 1077765198], length 0
12:31:42.118296 IP localhost.6379 > localhost.58768: Flags [P.], seq 1:51, ack 14, win 6377, options [nop,nop,TS val 1077765199 ecr 1077765198], length 50: RESP "ERR wrong number of arguments for 'set' command"
12:31:42.118313 IP localhost.58768 > localhost.6379: Flags [.], ack 51, win 6088, options [nop,nop,TS val 1077765199 ecr 1077765199], length 0
```

**Comment by vmihailenco** [comment]
3rd argument is not available on old Redis versions.

**Comment by x1nchen** [comment]
> 3rd argument is not available on old Redis versions.

Oh, Thanx. I ignored the version of redis server.
